fecha,producto,carrefour,coope,coto,dia,disco,vea
2025-08-05,Alimento A Base De Plantas Bastoncitos Not Cheese 300g,,,"$4.433,00",,,
2025-08-05,Alimento A Base De Plantas Not Chicken Mila 220g,,,"$3.171,35",,,
2025-08-05,Alimento A Base De Plantas Not Chorixo 240g,,,"$4.875,00",,,
2025-08-05,Alimento A Base De Plantas Not Mila 220g,,,"$2.742,35",,,
2025-08-05,Alimento A Base De Plantas Nuggets Not Chiken 300g,,,"$4.776,85",,,
2025-08-05,Alimento A Base De Plantas Picada Not Meat 400g,,,"$4.663,10",,,
2025-08-05,Alimento A Base De Plantas Relleno Champis Not Chicken 240g,,,"$3.307,85",,,
2025-08-05,Alimento A Base De Plantas Relleno De Espinaca Not Chiken 240g,,,"$3.506,75",,,
2025-08-05,Alimento A Base De Plantas Relleno Napolitana Not Chiken 240g,,,"$3.506,75",,,
2025-08-05,Alimento A Base De Plantas Spicy Not Chicken 250g,,,"$4.575,35",,,
2025-08-05,Barra proteica Not Protein almond salted 45 grs,"$ 1.299,33",,,,,
2025-08-05,Barra proteica Not Protein barry pie 45 grs,"$ 1.299,33",,,,,
2025-08-05,Barra proteica Not Protein chocolate 45 grs,"$ 1.299,33",,,,,
2025-08-05,Barra proteica NotProtein crunchy chocomani 35 grs,"$ 1.750,00",,,,,
2025-08-05,Barra proteica Notprotein crunchy netflix 35 grs,"$ 1.750,00",,,,,
2025-08-05,Bastoncitos Not cheese en bolsa 300 g.,"$ 6.819,00",,,,,
2025-08-05,Bocadito plant based spicy bites Not Chicken 250 g.,"$ 4.223,40",,,,,
2025-08-05,Bocaditos De Pollo Spicy Bites 250 Gr Not Chicken,,,,,$5.460,
2025-08-05,Burger Crispy 2 Un X 100 Gr Not Chicken,,,,,$4.340,$3.990
2025-08-05,Chicken Crispy Rellena Champis X 240 Gr Not Chicken,,,,,$3.955,
2025-08-05,Chorizo Vegano X 240 Gr Not Chorixo,,,,,$8.100,
2025-08-05,Chorizo a base de planta NotChorixo 240 grs,"$ 5.135,00",,,,,
2025-08-05,Crocantes Con Hierbas Not Chiken 300 Grm,,,"$4.776,85",,,
2025-08-05,Formados Notchicken Spicy Bit Con Salsa Tabasco 250grs,,"$$5.257,50",,,,
2025-08-05,Helado Chocolate Chip NOT ICE CREAM 330 Grm,,,"$5.395,00",,,
2025-08-05,Helado Chocolate Chips 100 Gr Not Icecream,,,,,$3.050,$2.800
2025-08-05,Helado Chocolate Chips 330 Gr Not Icecream,,,,,$9.100,$8.400
2025-08-05,Helado Cookies And Cream 330 Gr Not Icecream,,,,,,$8.400
2025-08-05,Helado Frutillas Con Crema 330 Gr Not Icecream,,,,,,$8.400
2025-08-05,Helado Not ice cookes cream 330 g.,"$ 8.300,00",,,,,
2025-08-05,Helado Not ice cream chocolate chips pote 100 g.,"$ 2.900,00",,,,,
2025-08-05,Helado Super Dulce De Leche 330 Gr Not Icecream,,,,,,$8.400
2025-08-05,Helado Vegetal Cookies Y Cream Not Ice 330g,,,"$5.395,00",,,
2025-08-05,Helado Vegetal Super Dulce De Leche Not Ice Cream 330g,,,"$5.395,00",,,
2025-08-05,Helado de chocolate chips NotIceCream® 330 g.,"$ 8.300,00",,,,,
2025-08-05,Helado de frutillas con crema NotIceCream® 330 g.,"$ 8.750,00",,,,,
2025-08-05,Medallon A Base De Vegetal X2 Not Burger 160g,,,"$3.240,25",,,
2025-08-05,Medallon A Base De Vegetal X4 Not Burger 320g,,,"$5.849,35",,,
2025-08-05,Medallon A Base De Vegetal Xl X2 Not Burger 240g,,,"$4.841,85",,,
2025-08-05,Medallon A Base De Vegetales Not Burger 130g,,,"$2.007,85",,,
2025-08-05,Medallon Not chicken burger flow pack x2 80 g.,"$ 2.781,35",,,,,
2025-08-05,Medallon Notchicken Relleno Espinaca Notco 240 Gr.,,,,$ 5.550,,
2025-08-05,Medallones Estilo Parrillera Not Burger 220 Grm,,,"$4.072,25",,,
2025-08-05,Medallones Notco Burger Estilo Parrillera Congelados X2 110grs,,"$$6.820,00",,,,
2025-08-05,Medallones Notco Not Burger Premium X4 320grs,,"$$9.050,00",,,,
2025-08-05,Medallones Notco Not Burger X2 160grs,,"$$5.020,00",,,,
2025-08-05,Medallones Notco Not Burger Xl Premium X2 240grs,,"$$7.480,00",,,,
2025-08-05,Medallones Notco Not Chicken Crispy Rellenas Napolitanas X2 0.24kgs,,"$$4.312,50",,,,
2025-08-05,Medallones Notco Not Chicken Crispy Rellenos Espinaca X2 0.24kgs,,"$$4.312,50",,,,
2025-08-05,Medallones Notco Notburger Quick Sabor Carne X2 130grs,,"$$3.250,00",,,,
2025-08-05,Medallón A Base De Plantas Sabor Pollo Not Chiken 200g,,,"$3.610,75",,,
2025-08-05,Medallón A Base De Vegetales Not Chiken 160g,,,"$2.781,35",,,
2025-08-05,Medallón Not Burger Premium 320 Gr X 4 Un Not Co,,,,,,$9.100
2025-08-05,Medallón Not burger parrillera 2 uni,"$ 4.068,00",,,,,
2025-08-05,Medallón Not burger premium XL flow pack 2 uni,"$ 7.449,00",,,,,
2025-08-05,Medallón Not burger premium flow pack 2 uni,"$ 4.985,00",,,,,
2025-08-05,Medallón Not burger premium flow pack 4 uni,"$ 5.849,35",,,,,
2025-08-05,Medallón Not burger quick flow pack 2 uni,"$ 2.007,85",,,,,
2025-08-05,Medallón Not chicken rellena flow pack 2 uni,"$ 5.395,00",,,,,
2025-08-05,Medallón The Not Co Premium Not Burger 160 Gr X 2 U,,,,,$5.550,$5.100
2025-08-05,Medallón The Not Co Premium Not Burger 240 Gr X 2 U,,,,,,$7.600
2025-08-05,Medallón crispy Not chicken burger flowpack x2 100 g.,"$ 5.500,00",,,,,
2025-08-05,Medallón relleno champis NotChicken 240 grs,"$ 3.562,30",,,,,
2025-08-05,Medallón relleno espinaca Not chicken 240 g.,"$ 5.390,00",,,,,
2025-08-05,Mila con semillas NotChicken 110 grs,"$ 5.365,00",,,,,
2025-08-05,Mila con semillas NotMila 110 grs,"$ 3.016,00",,,,,
2025-08-05,Milanesa 2.0 Notmila 110 Gr.,,,,$ 4.215,,
2025-08-05,Milanesa Not Chicken Mila 110 Gr X 2 U,,,,,$5.300,$4.900
2025-08-05,Milanesa Notchicken 2.0 Not Mila 110 Gr.,,,,$ 5.020,,
2025-08-05,Milanesas Notco Not Chicken Mila X2 220grs,,"$$3.667,50",,,,
2025-08-05,Milanesas Notco Not Mila X2 220grs,,"$$4.280,00",,,,
2025-08-05,Not Burger Parrillera 220 Gr.,,,,$ 6.450,,
2025-08-05,Not Burguer Quick 2 U De 65 Gr,,,,,$3.350,$3.100
2025-08-05,Not Burguer Quick Notco 140 Gr.,,,,$ 3.090,,
2025-08-05,Not Chicken Burger 2 Un X 80 Gr Not Chicken,,,,,$3.360,$3.080
2025-08-05,Not Chicken Crispy The Not Co Rellena Espinaca 240 Gr,,,,,$4.165,$3.850
2025-08-05,Not Chicken Crispy The Not Co Rellena Napolitana 240 Gr,,,,,$4.165,$3.850
2025-08-05,NotChickenMila 2.0 220 g.,"$ 3.169,00",,,,,
2025-08-05,NotMila meat 2.0 220 g.,"$ 4.209,00",,,,,
2025-08-05,Notburger The Not Co Parrillera 110 Gr,,,,,$6.950,$6.400
2025-08-05,Notcheese Cheddar Notco 140 Gr.,,,,$ 3.865,,
2025-08-05,Notcheese Dambo Notco 140 Gr.,,,,$ 5.450,,
2025-08-05,Notchicken Burger Crispy X2 200grs,,"$$5.530,00",,,,
2025-08-05,Notchicken Burger X2 160grs,,"$$3.247,50",,,,
2025-08-05,Notchicken Mila Notco Con Semillas 220grs,,"$$5.600,00",,,,
2025-08-05,Notco Not Salxicha X5 250grs,,"$$5.710,00",,,,
2025-08-05,Notmila Notco Con Semillas 220grs,,"$$4.800,00",,,,
2025-08-05,Nuggets 300 Gr Not Chicken,,,,,$5.670,$5.250
2025-08-05,Nuggets Not Chicken 300 Gr.,,,,$ 7.565,,
2025-08-05,Nuggets Not chicken en bolsa 300 g.,"$ 3.672,50",,,,,
2025-08-05,Nuggets Not chicken sticks 300 g.,"$ 4.776,85",,,,,
2025-08-05,Nuggets Notchicken Notco 0.3kgs,,"$$5.565,00",,,,
2025-08-05,Nuggets Notco Not Chicken Sticks Con Hierbas Congelados 300grs,,"$$5.565,00",,,,
2025-08-05,Paletas Heladas Chocolate Blanco 4 Un X 240 Gr Not Icecream,,,,,$10.050,
2025-08-05,Paletas Heladas Crema Americana 4 Un X 240 Gr Not Icecream®,,,,,$10.050,
2025-08-05,Paletas Heladas De Chocolate Blanco Not Icecream 4 X 240 Gr,,,"$5.918,25",,,
2025-08-05,Paletas Heladas De Chocolate Crocante Not Icecream 4 X 240 Gr,,,"$5.918,25",,,
2025-08-05,Paletas Heladas De Crema Americana Not Icecream 4 X 240 Gr,,,"$5.918,25",,,
2025-08-05,Paletas heladas de chocolate blanco NotIceCream® 4 x 240 g.,"$ 9.099,00",,,,,
2025-08-05,Paletas heladas de crema americana NotIceCream® 4 x 240 g.,"$ 9.105,00",,,,,
2025-08-05,Producto A Base De Aceite Vegetal Notco Not Cheese Sabor Danbo 140grs,,"$$4.870,00",,,,
2025-08-05,Producto A Base De Plantas Notcheese Sabor Mozzarella 250grs,,"$$4.200,00",,,,
2025-08-05,Queso Crema Not Cream 210 Gr.,,,,$ 4.420,,
2025-08-05,Queso Vegano Mozzarella Not Cheese 250g,,,"$5.365,00",,,
2025-08-05,Salchicha de planta Not Salxicha 5 uni,"$ 5.719,00",,,,,
2025-08-05,Salchichas A Base De Plantas Not Salxicha 250g,,,"$3.717,35",,,
2025-08-05,Sticks 300 Gr Not Chicken,,,,,$5.600,$5.180
2025-08-05,Tabletas Heladas Dulce De Leche 300 Gr Not Icecream,,,,,$10.400,
2025-08-05,Tabletas Heladas Menta 300 Gr Not Icecream,,,,,$10.400,
